{
  "format": "ocker-document",
  "version": "0.1.0",
  "document": {
    "id": "jill-affidavit",
    "title": "Jill Blogs — fictional affidavit",
    "kind": "affidavit",
    "author": "Jill Blogs",
    "assetId": "jill-affidavit-pdf",
    "paragraphs": [
      {
        "id": "jill-affidavit-p1",
        "page": 1,
        "label": "1",
        "text": "Joe and I married in 2017."
      },
      {
        "id": "jill-affidavit-p2",
        "page": 1,
        "label": "2",
        "text": "Johnny did not attend the agreed weekend visit on 25 May 2024."
      },
      {
        "id": "jill-affidavit-p3",
        "page": 1,
        "label": "3",
        "text": "I made no threat to withdraw child support on 29 May 2024."
      },
      {
        "id": "jill-affidavit-p4",
        "page": 1,
        "label": "4",
        "text": "On 10 October 2024, I sent Joe an email with the subject test."
      },
      {
        "id": "jill-affidavit-p5",
        "page": 1,
        "label": "5",
        "text": "On 3 November 2025, Joe struck me across the face."
      },
      {
        "id": "jill-affidavit-p6",
        "page": 1,
        "label": "6",
        "text": "We separated on a final basis on 3 November 2025."
      }
    ]
  },
  "asset": {
    "id": "jill-affidavit-pdf",
    "name": "JillBlogsAffidavit.pdf",
    "mediaType": "application/pdf",
    "sha256": "0a6387d3af497d5aca91b93860c2506bfe182b4e890483f57145ac00f2eb31a1",
    "byteLength": 4203,
    "data": "JVBERi0xLjMKJbrfrOAKMyAwIG9iago8PC9UeXBlIC9QYWdlCi9QYXJlbnQgMSAwIFIKL1Jlc291cmNlcyAyIDAgUgovTWVkaWFCb3ggWzAgMCA1OTUuMjc5OTk5OTk5OTk5OTcyNyA4NDEuODg5OTk5OTk5OTk5OTg2NF0KL0NvbnRlbnRzIDQgMCBSCj4+CmVuZG9iago0IDAgb2JqCjw8Ci9MZW5ndGggMTE2Nwo+PgpzdHJlYW0KMC41NjcwMDAwMDAwMDAwMDAxIHcKMCBHCkJUCi9GMiAyMCBUZgoyMy4gVEwKMCBnCjU2LjY5MjkxMzM4NTgyNjc3NzUgNzcxLjAyMzg1ODI2NzcxNjQ5MTQgVGQKKEZpY3Rpb25hbCBhZmZpZGF2aXQpIFRqCkVUCkJUCi9GMiAxMyBUZgoxNC45NDk5OTk5OTk5OTk5OTkzIFRMCjAgZwo1Ni42OTI5MTMzODU4MjY3Nzc1IDczNy4wMDgxMTAyMzYyMjA0MzE5IFRkCihKaWxsIEJsb2dzKSBUagpFVApCVAovRjEgMTAgVGYKMTEuNSBUTAowIGcKNTYuNjkyOTEzMzg1ODI2Nzc3NSA3MDUuODI3MDA3ODc0MDE1NzQ4NyBUZAooT0NLRVIgdHJhaW5pbmcgZXhhbXBsZS4gRmljdGlvbmFsIHBhcnRpZXMgYW5kIGV2ZW50czsgbm90IGEgY291cnQgZmlsaW5nLikgVGoKRVQKQlQKL0YxIDEwIFRmCjExLjUgVEwKMCBnCjU2LjY5MjkxMzM4NTgyNjc3NzUgNjU3LjYzODAzMTQ5NjA2MjkyMjEgVGQKKDEuIEpvZSBhbmQgSSBtYXJyaWVkIGluIDIwMTcuKSBUagpFVApCVAovRjEgMTAgVGYKMTEuNSBUTAowIGcKNTYuNjkyOTEzMzg1ODI2Nzc3NSA1ODMuOTM3MjQ0MDk0NDg4MTY0NiBUZAooMi4gSm9obm55IGRpZCBub3QgYXR0ZW5kIHRoZSBhZ3JlZWQgd2Vla2VuZCB2aXNpdCBvbiAyNSBNYXkgMjAyNC4pIFRqCkVUCkJUCi9GMSAxMCBUZgoxMS41IFRMCjAgZwo1Ni42OTI5MTMzODU4MjY3Nzc1IDUxMC4yMzY0NTY2OTI5MTMzNTAzIFRkCigzLiBJIG1hZGUgbm8gdGhyZWF0IHRvIHdpdGhkcmF3IGNoaWxkIHN1cHBvcnQgb24gMjkgTWF5IDIwMjQuKSBUagpFVApCVAovRjEgMTAgVGYKMTEuNSBUTAowIGcKNTYuNjkyOTEzMzg1ODI2Nzc3NSA0MzYuNTM1NjY5MjkxMzM4NTM1OSBUZAooNC4gT24gMTAgT2N0b2JlciAyMDI0LCBJIHNlbnQgSm9lIGFuIGVtYWlsIHdpdGggdGhlIHN1YmplY3QgdGVzdC4pIFRqCkVUCkJUCi9GMSAxMCBUZgoxMS41IFRMCjAgZwo1Ni42OTI5MTMzODU4MjY3Nzc1IDM2Mi44MzQ4ODE4ODk3NjM3MjE2IFRkCig1LiBPbiAzIE5vdmVtYmVyIDIwMjUsIEpvZSBzdHJ1Y2sgbWUgYWNyb3NzIHRoZSBmYWNlLikgVGoKRVQKQlQKL0YxIDEwIFRmCjExLjUgVEwKMCBnCjU2LjY5MjkxMzM4NTgyNjc3NzUgMjg5LjEzNDA5NDQ4ODE4ODkwNzIgVGQKKDYuIFdlIHNlcGFyYXRlZCBvbiBhIGZpbmFsIGJhc2lzIG9uIDMgTm92ZW1iZXIgMjAyNS4pIFRqCkVUCmVuZHN0cmVhbQplbmRvYmoKMSAwIG9iago8PC9UeXBlIC9QYWdlcwovS2lkcyBbMyAwIFIgXQovQ291bnQgMQo+PgplbmRvYmoKNSAwIG9iago8PAovVHlwZSAvRm9udAovQmFzZUZvbnQgL0hlbHZldGljYQovU3VidHlwZSAvVHlwZTEKL0VuY29kaW5nIC9XaW5BbnNpRW5jb2RpbmcKL0ZpcnN0Q2hhciAzMgovTGFzdENoYXIgMjU1Cj4+CmVuZG9iago2IDAgb2JqCjw8Ci9UeXBlIC9Gb250Ci9CYXNlRm9udCAvSGVsdmV0aWNhLUJvbGQKL1N1YnR5cGUgL1R5cGUxCi9FbmNvZGluZyAvV2luQW5zaUVuY29kaW5nCi9GaXJzdENoYXIgMzIKL0xhc3RDaGFyIDI1NQo+PgplbmRvYmoKNyAwIG9iago8PAovVHlwZSAvRm9udAovQmFzZUZvbnQgL0hlbHZldGljYS1PYmxpcXVlCi9TdWJ0eXBlIC9UeXBlMQovRW5jb2RpbmcgL1dpbkFuc2lFbmNvZGluZwovRmlyc3RDaGFyIDMyCi9MYXN0Q2hhciAyNTUKPj4KZW5kb2JqCjggMCBvYmoKPDwKL1R5cGUgL0ZvbnQKL0Jhc2VGb250IC9IZWx2ZXRpY2EtQm9sZE9ibGlxdWUKL1N1YnR5cGUgL1R5cGUxCi9FbmNvZGluZyAvV2luQW5zaUVuY29kaW5nCi9GaXJzdENoYXIgMzIKL0xhc3RDaGFyIDI1NQo+PgplbmRvYmoKOSAwIG9iago8PAovVHlwZSAvRm9udAovQmFzZUZvbnQgL0NvdXJpZXIKL1N1YnR5cGUgL1R5cGUxCi9FbmNvZGluZyAvV2luQW5zaUVuY29kaW5nCi9GaXJzdENoYXIgMzIKL0xhc3RDaGFyIDI1NQo+PgplbmRvYmoKMTAgMCBvYmoKPDwKL1R5cGUgL0ZvbnQKL0Jhc2VGb250IC9Db3VyaWVyLUJvbGQKL1N1YnR5cGUgL1R5cGUxCi9FbmNvZGluZyAvV2luQW5zaUVuY29kaW5nCi9GaXJzdENoYXIgMzIKL0xhc3RDaGFyIDI1NQo+PgplbmRvYmoKMTEgMCBvYmoKPDwKL1R5cGUgL0ZvbnQKL0Jhc2VGb250IC9Db3VyaWVyLU9ibGlxdWUKL1N1YnR5cGUgL1R5cGUxCi9FbmNvZGluZyAvV2luQW5zaUVuY29kaW5nCi9GaXJzdENoYXIgMzIKL0xhc3RDaGFyIDI1NQo+PgplbmRvYmoKMTIgMCBvYmoKPDwKL1R5cGUgL0ZvbnQKL0Jhc2VGb250IC9Db3VyaWVyLUJvbGRPYmxpcXVlCi9TdWJ0eXBlIC9UeXBlMQovRW5jb2RpbmcgL1dpbkFuc2lFbmNvZGluZwovRmlyc3RDaGFyIDMyCi9MYXN0Q2hhciAyNTUKPj4KZW5kb2JqCjEzIDAgb2JqCjw8Ci9UeXBlIC9Gb250Ci9CYXNlRm9udCAvVGltZXMtUm9tYW4KL1N1YnR5cGUgL1R5cGUxCi9FbmNvZGluZyAvV2luQW5zaUVuY29kaW5nCi9GaXJzdENoYXIgMzIKL0xhc3RDaGFyIDI1NQo+PgplbmRvYmoKMTQgMCBvYmoKPDwKL1R5cGUgL0ZvbnQKL0Jhc2VGb250IC9UaW1lcy1Cb2xkCi9TdWJ0eXBlIC9UeXBlMQovRW5jb2RpbmcgL1dpbkFuc2lFbmNvZGluZwovRmlyc3RDaGFyIDMyCi9MYXN0Q2hhciAyNTUKPj4KZW5kb2JqCjE1IDAgb2JqCjw8Ci9UeXBlIC9Gb250Ci9CYXNlRm9udCAvVGltZXMtSXRhbGljCi9TdWJ0eXBlIC9UeXBlMQovRW5jb2RpbmcgL1dpbkFuc2lFbmNvZGluZwovRmlyc3RDaGFyIDMyCi9MYXN0Q2hhciAyNTUKPj4KZW5kb2JqCjE2IDAgb2JqCjw8Ci9UeXBlIC9Gb250Ci9CYXNlRm9udCAvVGltZXMtQm9sZEl0YWxpYwovU3VidHlwZSAvVHlwZTEKL0VuY29kaW5nIC9XaW5BbnNpRW5jb2RpbmcKL0ZpcnN0Q2hhciAzMgovTGFzdENoYXIgMjU1Cj4+CmVuZG9iagoxNyAwIG9iago8PAovVHlwZSAvRm9udAovQmFzZUZvbnQgL1phcGZEaW5nYmF0cwovU3VidHlwZSAvVHlwZTEKL0ZpcnN0Q2hhciAzMgovTGFzdENoYXIgMjU1Cj4+CmVuZG9iagoxOCAwIG9iago8PAovVHlwZSAvRm9udAovQmFzZUZvbnQgL1N5bWJvbAovU3VidHlwZSAvVHlwZTEKL0ZpcnN0Q2hhciAzMgovTGFzdENoYXIgMjU1Cj4+CmVuZG9iagoyIDAgb2JqCjw8Ci9Qcm9jU2V0IFsvUERGIC9UZXh0IC9JbWFnZUIgL0ltYWdlQyAvSW1hZ2VJXQovRm9udCA8PAovRjEgNSAwIFIKL0YyIDYgMCBSCi9GMyA3IDAgUgovRjQgOCAwIFIKL0Y1IDkgMCBSCi9GNiAxMCAwIFIKL0Y3IDExIDAgUgovRjggMTIgMCBSCi9GOSAxMyAwIFIKL0YxMCAxNCAwIFIKL0YxMSAxNSAwIFIKL0YxMiAxNiAwIFIKL0YxMyAxNyAwIFIKL0YxNCAxOCAwIFIKPj4KL1hPYmplY3QgPDwKPj4KPj4KZW5kb2JqCjE5IDAgb2JqCjw8Ci9Qcm9kdWNlciAoanNQREYgNC4yLjEpCi9DcmVhdGlvbkRhdGUgKEQ6MjAyNjEwMjMyMTAyMTUrMTAnMDAnKQo+PgplbmRvYmoKMjAgMCBvYmoKPDwKL1R5cGUgL0NhdGFsb2cKL1BhZ2VzIDEgMCBSCi9PcGVuQWN0aW9uIFszIDAgUiAvRml0SCBudWxsXQovUGFnZUxheW91dCAvT25lQ29sdW1uCj4+CmVuZG9iagp4cmVmCjAgMjEKMDAwMDAwMDAwMCA2NTUzNSBmIAowMDAwMDAxMzcxIDAwMDAwIG4gCjAwMDAwMDMxODggMDAwMDAgbiAKMDAwMDAwMDAxNSAwMDAwMCBuIAowMDAwMDAwMTUyIDAwMDAwIG4gCjAwMDAwMDE0MjggMDAwMDAgbiAKMDAwMDAwMTU1MyAwMDAwMCBuIAowMDAwMDAxNjgzIDAwMDAwIG4gCjAwMDAwMDE4MTYgMDAwMDAgbiAKMDAwMDAwMTk1MyAwMDAwMCBuIAowMDAwMDAyMDc2IDAwMDAwIG4gCjAwMDAwMDIyMDUgMDAwMDAgbiAKMDAwMDAwMjMzNyAwMDAwMCBuIAowMDAwMDAyNDczIDAwMDAwIG4gCjAwMDAwMDI2MDEgMDAwMDAgbiAKMDAwMDAwMjcyOCAwMDAwMCBuIAowMDAwMDAyODU3IDAwMDAwIG4gCjAwMDAwMDI5OTAgMDAwMDAgbiAKMDAwMDAwMzA5MiAwMDAwMCBuIAowMDAwMDAzNDM2IDAwMDAwIG4gCjAwMDAwMDM1MjIgMDAwMDAgbiAKdHJhaWxlcgo8PAovU2l6ZSAyMQovUm9vdCAyMCAwIFIKL0luZm8gMTkgMCBSCi9JRCBbIDxBNUNGMEY5QTVCRThDNTBDNDZEN0Q4MkFCNzBDQkEzOT4gPEE1Q0YwRjlBNUJFOEM1MEM0NkQ3RDgyQUI3MENCQTM5PiBdCj4+CnN0YXJ0eHJlZgozNjI2CiUlRU9G"
  }
}
