{
  "format": "ocker-document",
  "version": "0.1.0",
  "document": {
    "id": "joe-affidavit",
    "title": "Joe Blogs — fictional affidavit",
    "kind": "affidavit",
    "author": "Joe Blogs",
    "assetId": "joe-affidavit-pdf",
    "paragraphs": [
      {
        "id": "joe-affidavit-p1",
        "page": 1,
        "label": "1",
        "text": "We married in 2017."
      },
      {
        "id": "joe-affidavit-p2",
        "page": 1,
        "label": "2",
        "text": "On 25 May 2024, Johnny did not attend my agreed weekend visit."
      },
      {
        "id": "joe-affidavit-p3",
        "page": 1,
        "label": "3",
        "text": "On 29 May 2024, Jill threatened to withdraw child support unless I agreed."
      },
      {
        "id": "joe-affidavit-p4",
        "page": 1,
        "label": "4",
        "text": "On 10 October 2024, Jill sent me an email with the subject test."
      },
      {
        "id": "joe-affidavit-p5",
        "page": 1,
        "label": "5",
        "text": "I did not strike Jill on 3 November 2025."
      },
      {
        "id": "joe-affidavit-p6",
        "page": 1,
        "label": "6",
        "text": "We separated on 3 November 2025."
      }
    ]
  },
  "asset": {
    "id": "joe-affidavit-pdf",
    "name": "JoeBlogsAffidavit.pdf",
    "mediaType": "application/pdf",
    "sha256": "ccbe957b9eaad82796bc53ad6173c751ed5cdd1137cf027e96f15d4cef69dea4",
    "byteLength": 4187,
    "data": "JVBERi0xLjMKJbrfrOAKMyAwIG9iago8PC9UeXBlIC9QYWdlCi9QYXJlbnQgMSAwIFIKL1Jlc291cmNlcyAyIDAgUgovTWVkaWFCb3ggWzAgMCA1OTUuMjc5OTk5OTk5OTk5OTcyNyA4NDEuODg5OTk5OTk5OTk5OTg2NF0KL0NvbnRlbnRzIDQgMCBSCj4+CmVuZG9iago0IDAgb2JqCjw8Ci9MZW5ndGggMTE1MQo+PgpzdHJlYW0KMC41NjcwMDAwMDAwMDAwMDAxIHcKMCBHCkJUCi9GMiAyMCBUZgoyMy4gVEwKMCBnCjU2LjY5MjkxMzM4NTgyNjc3NzUgNzcxLjAyMzg1ODI2NzcxNjQ5MTQgVGQKKEZpY3Rpb25hbCBhZmZpZGF2aXQpIFRqCkVUCkJUCi9GMiAxMyBUZgoxNC45NDk5OTk5OTk5OTk5OTkzIFRMCjAgZwo1Ni42OTI5MTMzODU4MjY3Nzc1IDczNy4wMDgxMTAyMzYyMjA0MzE5IFRkCihKb2UgQmxvZ3MpIFRqCkVUCkJUCi9GMSAxMCBUZgoxMS41IFRMCjAgZwo1Ni42OTI5MTMzODU4MjY3Nzc1IDcwNS44MjcwMDc4NzQwMTU3NDg3IFRkCihPQ0tFUiB0cmFpbmluZyBleGFtcGxlLiBGaWN0aW9uYWwgcGFydGllcyBhbmQgZXZlbnRzOyBub3QgYSBjb3VydCBmaWxpbmcuKSBUagpFVApCVAovRjEgMTAgVGYKMTEuNSBUTAowIGcKNTYuNjkyOTEzMzg1ODI2Nzc3NSA2NTcuNjM4MDMxNDk2MDYyOTIyMSBUZAooMS4gV2UgbWFycmllZCBpbiAyMDE3LikgVGoKRVQKQlQKL0YxIDEwIFRmCjExLjUgVEwKMCBnCjU2LjY5MjkxMzM4NTgyNjc3NzUgNTgzLjkzNzI0NDA5NDQ4ODE2NDYgVGQKKDIuIE9uIDI1IE1heSAyMDI0LCBKb2hubnkgZGlkIG5vdCBhdHRlbmQgbXkgYWdyZWVkIHdlZWtlbmQgdmlzaXQuKSBUagpFVApCVAovRjEgMTAgVGYKMTEuNSBUTAowIGcKNTYuNjkyOTEzMzg1ODI2Nzc3NSA1MTAuMjM2NDU2NjkyOTEzMzUwMyBUZAooMy4gT24gMjkgTWF5IDIwMjQsIEppbGwgdGhyZWF0ZW5lZCB0byB3aXRoZHJhdyBjaGlsZCBzdXBwb3J0IHVubGVzcyBJIGFncmVlZC4pIFRqCkVUCkJUCi9GMSAxMCBUZgoxMS41IFRMCjAgZwo1Ni42OTI5MTMzODU4MjY3Nzc1IDQzNi41MzU2NjkyOTEzMzg1MzU5IFRkCig0LiBPbiAxMCBPY3RvYmVyIDIwMjQsIEppbGwgc2VudCBtZSBhbiBlbWFpbCB3aXRoIHRoZSBzdWJqZWN0IHRlc3QuKSBUagpFVApCVAovRjEgMTAgVGYKMTEuNSBUTAowIGcKNTYuNjkyOTEzMzg1ODI2Nzc3NSAzNjIuODM0ODgxODg5NzYzNzIxNiBUZAooNS4gSSBkaWQgbm90IHN0cmlrZSBKaWxsIG9uIDMgTm92ZW1iZXIgMjAyNS4pIFRqCkVUCkJUCi9GMSAxMCBUZgoxMS41IFRMCjAgZwo1Ni42OTI5MTMzODU4MjY3Nzc1IDI4OS4xMzQwOTQ0ODgxODg5MDcyIFRkCig2LiBXZSBzZXBhcmF0ZWQgb24gMyBOb3ZlbWJlciAyMDI1LikgVGoKRVQKZW5kc3RyZWFtCmVuZG9iagoxIDAgb2JqCjw8L1R5cGUgL1BhZ2VzCi9LaWRzIFszIDAgUiBdCi9Db3VudCAxCj4+CmVuZG9iago1IDAgb2JqCjw8Ci9UeXBlIC9Gb250Ci9CYXNlRm9udCAvSGVsdmV0aWNhCi9TdWJ0eXBlIC9UeXBlMQovRW5jb2RpbmcgL1dpbkFuc2lFbmNvZGluZwovRmlyc3RDaGFyIDMyCi9MYXN0Q2hhciAyNTUKPj4KZW5kb2JqCjYgMCBvYmoKPDwKL1R5cGUgL0ZvbnQKL0Jhc2VGb250IC9IZWx2ZXRpY2EtQm9sZAovU3VidHlwZSAvVHlwZTEKL0VuY29kaW5nIC9XaW5BbnNpRW5jb2RpbmcKL0ZpcnN0Q2hhciAzMgovTGFzdENoYXIgMjU1Cj4+CmVuZG9iago3IDAgb2JqCjw8Ci9UeXBlIC9Gb250Ci9CYXNlRm9udCAvSGVsdmV0aWNhLU9ibGlxdWUKL1N1YnR5cGUgL1R5cGUxCi9FbmNvZGluZyAvV2luQW5zaUVuY29kaW5nCi9GaXJzdENoYXIgMzIKL0xhc3RDaGFyIDI1NQo+PgplbmRvYmoKOCAwIG9iago8PAovVHlwZSAvRm9udAovQmFzZUZvbnQgL0hlbHZldGljYS1Cb2xkT2JsaXF1ZQovU3VidHlwZSAvVHlwZTEKL0VuY29kaW5nIC9XaW5BbnNpRW5jb2RpbmcKL0ZpcnN0Q2hhciAzMgovTGFzdENoYXIgMjU1Cj4+CmVuZG9iago5IDAgb2JqCjw8Ci9UeXBlIC9Gb250Ci9CYXNlRm9udCAvQ291cmllcgovU3VidHlwZSAvVHlwZTEKL0VuY29kaW5nIC9XaW5BbnNpRW5jb2RpbmcKL0ZpcnN0Q2hhciAzMgovTGFzdENoYXIgMjU1Cj4+CmVuZG9iagoxMCAwIG9iago8PAovVHlwZSAvRm9udAovQmFzZUZvbnQgL0NvdXJpZXItQm9sZAovU3VidHlwZSAvVHlwZTEKL0VuY29kaW5nIC9XaW5BbnNpRW5jb2RpbmcKL0ZpcnN0Q2hhciAzMgovTGFzdENoYXIgMjU1Cj4+CmVuZG9iagoxMSAwIG9iago8PAovVHlwZSAvRm9udAovQmFzZUZvbnQgL0NvdXJpZXItT2JsaXF1ZQovU3VidHlwZSAvVHlwZTEKL0VuY29kaW5nIC9XaW5BbnNpRW5jb2RpbmcKL0ZpcnN0Q2hhciAzMgovTGFzdENoYXIgMjU1Cj4+CmVuZG9iagoxMiAwIG9iago8PAovVHlwZSAvRm9udAovQmFzZUZvbnQgL0NvdXJpZXItQm9sZE9ibGlxdWUKL1N1YnR5cGUgL1R5cGUxCi9FbmNvZGluZyAvV2luQW5zaUVuY29kaW5nCi9GaXJzdENoYXIgMzIKL0xhc3RDaGFyIDI1NQo+PgplbmRvYmoKMTMgMCBvYmoKPDwKL1R5cGUgL0ZvbnQKL0Jhc2VGb250IC9UaW1lcy1Sb21hbgovU3VidHlwZSAvVHlwZTEKL0VuY29kaW5nIC9XaW5BbnNpRW5jb2RpbmcKL0ZpcnN0Q2hhciAzMgovTGFzdENoYXIgMjU1Cj4+CmVuZG9iagoxNCAwIG9iago8PAovVHlwZSAvRm9udAovQmFzZUZvbnQgL1RpbWVzLUJvbGQKL1N1YnR5cGUgL1R5cGUxCi9FbmNvZGluZyAvV2luQW5zaUVuY29kaW5nCi9GaXJzdENoYXIgMzIKL0xhc3RDaGFyIDI1NQo+PgplbmRvYmoKMTUgMCBvYmoKPDwKL1R5cGUgL0ZvbnQKL0Jhc2VGb250IC9UaW1lcy1JdGFsaWMKL1N1YnR5cGUgL1R5cGUxCi9FbmNvZGluZyAvV2luQW5zaUVuY29kaW5nCi9GaXJzdENoYXIgMzIKL0xhc3RDaGFyIDI1NQo+PgplbmRvYmoKMTYgMCBvYmoKPDwKL1R5cGUgL0ZvbnQKL0Jhc2VGb250IC9UaW1lcy1Cb2xkSXRhbGljCi9TdWJ0eXBlIC9UeXBlMQovRW5jb2RpbmcgL1dpbkFuc2lFbmNvZGluZwovRmlyc3RDaGFyIDMyCi9MYXN0Q2hhciAyNTUKPj4KZW5kb2JqCjE3IDAgb2JqCjw8Ci9UeXBlIC9Gb250Ci9CYXNlRm9udCAvWmFwZkRpbmdiYXRzCi9TdWJ0eXBlIC9UeXBlMQovRmlyc3RDaGFyIDMyCi9MYXN0Q2hhciAyNTUKPj4KZW5kb2JqCjE4IDAgb2JqCjw8Ci9UeXBlIC9Gb250Ci9CYXNlRm9udCAvU3ltYm9sCi9TdWJ0eXBlIC9UeXBlMQovRmlyc3RDaGFyIDMyCi9MYXN0Q2hhciAyNTUKPj4KZW5kb2JqCjIgMCBvYmoKPDwKL1Byb2NTZXQgWy9QREYgL1RleHQgL0ltYWdlQiAvSW1hZ2VDIC9JbWFnZUldCi9Gb250IDw8Ci9GMSA1IDAgUgovRjIgNiAwIFIKL0YzIDcgMCBSCi9GNCA4IDAgUgovRjUgOSAwIFIKL0Y2IDEwIDAgUgovRjcgMTEgMCBSCi9GOCAxMiAwIFIKL0Y5IDEzIDAgUgovRjEwIDE0IDAgUgovRjExIDE1IDAgUgovRjEyIDE2IDAgUgovRjEzIDE3IDAgUgovRjE0IDE4IDAgUgo+PgovWE9iamVjdCA8PAo+Pgo+PgplbmRvYmoKMTkgMCBvYmoKPDwKL1Byb2R1Y2VyIChqc1BERiA0LjIuMSkKL0NyZWF0aW9uRGF0ZSAoRDoyMDI2MTAyMzIxMDIxNSsxMCcwMCcpCj4+CmVuZG9iagoyMCAwIG9iago8PAovVHlwZSAvQ2F0YWxvZwovUGFnZXMgMSAwIFIKL09wZW5BY3Rpb24gWzMgMCBSIC9GaXRIIG51bGxdCi9QYWdlTGF5b3V0IC9PbmVDb2x1bW4KPj4KZW5kb2JqCnhyZWYKMCAyMQowMDAwMDAwMDAwIDY1NTM1IGYgCjAwMDAwMDEzNTUgMDAwMDAgbiAKMDAwMDAwMzE3MiAwMDAwMCBuIAowMDAwMDAwMDE1IDAwMDAwIG4gCjAwMDAwMDAxNTIgMDAwMDAgbiAKMDAwMDAwMTQxMiAwMDAwMCBuIAowMDAwMDAxNTM3IDAwMDAwIG4gCjAwMDAwMDE2NjcgMDAwMDAgbiAKMDAwMDAwMTgwMCAwMDAwMCBuIAowMDAwMDAxOTM3IDAwMDAwIG4gCjAwMDAwMDIwNjAgMDAwMDAgbiAKMDAwMDAwMjE4OSAwMDAwMCBuIAowMDAwMDAyMzIxIDAwMDAwIG4gCjAwMDAwMDI0NTcgMDAwMDAgbiAKMDAwMDAwMjU4NSAwMDAwMCBuIAowMDAwMDAyNzEyIDAwMDAwIG4gCjAwMDAwMDI4NDEgMDAwMDAgbiAKMDAwMDAwMjk3NCAwMDAwMCBuIAowMDAwMDAzMDc2IDAwMDAwIG4gCjAwMDAwMDM0MjAgMDAwMDAgbiAKMDAwMDAwMzUwNiAwMDAwMCBuIAp0cmFpbGVyCjw8Ci9TaXplIDIxCi9Sb290IDIwIDAgUgovSW5mbyAxOSAwIFIKL0lEIFsgPDYwQkYyNUUyMzQxMDQ4RjlDOEE4OEQ2NjgwMkZFNTg0PiA8NjBCRjI1RTIzNDEwNDhGOUM4QTg4RDY2ODAyRkU1ODQ+IF0KPj4Kc3RhcnR4cmVmCjM2MTAKJSVFT0Y="
  }
}
